"Name","Latitude","Longitude","Address"
"Swarthmore College",39.9037164752641,-75.3542761317193,"Swarthmore College, 500, College Avenue, Swarthmore, Delaware County, Pennsylvania, 19081, United States"
"University of Pittsburgh",40.4442580309976,-79.9589315399688,"University of Pittsburgh, 4200, Fifth Avenue, Chinatown, Downtown, Pittsburgh, Allegheny County, Pennsylvania, 15260, United States"
"Carnegie Mellon University",40.4438994236144,-79.9436025926316,"Carnegie Mellon University, Morewood Avenue, Squirrel Hill North, Pittsburgh, Allegheny County, Pennsylvania, 15213, United States"
"La Salle University",40.0388483494266,-75.156675737224,"La Salle University, North Norwood Street, Somerville, Philadelphia, Philadelphia County, Pennsylvania, 19138, United States"
"University of Pennsylvania",39.9497818202024,-75.1941351745955,"University of Pennsylvania, South Bambrey Street, Schuylkill, South Philadelphia, Philadelphia, Philadelphia County, Pennsylvania, 19104, United States"
"Lehigh University Asa Packer Campus",40.6034243408172,-75.3716682812272,"Sayre Field, Mountain Drive North, South Bethlehem, Star Village, Bethlehem, Northampton County, Pennsylvania, 18015, United States"
"Montgomery County Community College - West Campus",40.2447232861332,-75.6540285231003,"Montgomery County Community College - West Campus, Schuylkill River Trail (Thun Section), Pottstown, Montgomery County, Pennsylvania, 19464, United States"
"University of Pennsylvania Law School",39.9540343297668,-75.1926465374112,"University of Pennsylvania Law School, 3500, Sansom Street, University City, Philadelphia, Philadelphia County, Pennsylvania, 19104, United States"
"Community College of Allegheny County",40.4496777078142,-80.0131174944118,"Community College of Allegheny County, Brighton Road, Allegheny West, Pittsburgh, Allegheny County, Pennsylvania, 15290, United States"
"Penn State York",39.9516995127453,-76.7037054940704,"Penn State York, 1031, Edgecomb Avenue, Beverly Hills, Valley View, Rosemount, Spring Garden Township, York County, Pennsylvania, 17403, United States"
"Robert Morris University",40.5214787182253,-80.2114644763332,"Robert Morris University, 6001, University Boulevard, Carnot, Moon Township, Allegheny County, Pennsylvania, 15108, United States"
"Penn State Abington",40.1153826683808,-75.1106273661006,"Penn State Abington, Herring Road, Rydal Park, Abington Township, Montgomery County, Pennsylvania, 19001, United States"
"Penn State Altoona",40.5402696179731,-78.4101199764385,"Penn State Altoona, Pennway Avenue, Wehnwood, Altoona, Blair County, Pennsylvania, 16601, United States"
"Penn State DuBois",41.1272555015798,-78.7515837494793,"Penn State DuBois, 1, College Place, DuBois, Clearfield County, Pennsylvania, 15801, United States"
"Saint Joseph's University",39.9952602250924,-75.2403472320054,"Saint Joseph's University, Greystone Road, Lower Merion Township, Montgomery County, Pennsylvania, 19066, United States"
"Wilson College",39.9509562992372,-77.6529299848418,"Wilson College, 1015, Pennsylvania Avenue, Chambersburg, Franklin County, Pennsylvania, 17201, United States"
"University of Scranton",41.4055580909389,-75.6598558735996,"University of Scranton, 800, Linden Street, The Hill Section, Scranton, Lackawanna County, Pennsylvania, 18510, United States"
"Bucknell University",40.95153254178,-76.8883654906286,"Bucknell University, Malcolm Street, Lewisburg, Union County, Pennsylvania, 17837, United States"
"Franklin & Marshall College",40.0492283176477,-76.3200384062016,"Franklin & Marshall College, Harrisburg Avenue, Stadium District, Lancaster, Lancaster County, Pennsylvania, 17604, United States"
"Lafayette College",40.7121167665623,-75.2204660722651,"Town Center Boulevard, Forks Town Center, Chestnut Hill, Forks Township, Northampton County, Pennsylvania, 18040, United States"
"University of Valley Forge",40.1189204323712,-75.5500009862316,"Academic Way, Potter’s Pond, Schuylkill Township, Chester County, Pennsylvania, 19442, United States"
"Thomas Jefferson University",39.9488838589264,-75.1570870772168,"131, South 10th Street, Gayborhood, Center City, Philadelphia, Philadelphia County, Pennsylvania, 19109, United States"
"University",41.0159833882499,-76.448546066659,"Penn Street, Bloomsburg, Columbia County, Pennsylvania, 17815, United States"
"Alvernia University",40.3103354127244,-75.9349164186548,"Alvernia University, 400, Saint Bernadine Street, Reading, Berks County, Pennsylvania, 19607, United States"
"La Salle University",40.0388933316987,-75.1566039524489,"La Salle University, North Norwood Street, Somerville, Philadelphia, Philadelphia County, Pennsylvania, 19138, United States"
"Penn State University",40.8076286816982,-77.8624372596132,"East Park Avenue, College Township, Centre County, Pennsylvania, 16802, United States"
"Lock Haven University",41.1410536857734,-77.4647815857848,"Lock Haven University, Mill Street, Lock Haven, Clinton County, Pennsylvania, 17745, United States"
"Gettysburg College",39.8371153778327,-77.2368456890014,"Gettysburg College, Biglerville Road, Barlow Knoll, Gettysburg, Adams County, Pennsylvania, 17325, United States"
"Misericordia University",41.344532778972,-75.9703724134727,"Misericordia University, Lang Street, Dallas, Luzerne County, Pennsylvania, 18612, United States"
"Drexel University - Queen Lane Campus",40.0194058310008,-75.1798120391118,"Drexel University Queens Lane Campus, The Oak Road, East Falls, Philadelphia, Philadelphia County, Pennsylvania, 19129, United States"
"Drexel University",39.9566722368401,-75.1890396430292,"Drexel University, 3141, Chestnut Street, University City, Philadelphia, Philadelphia County, Pennsylvania, 19104, United States"
"Central Penn College",40.3044078729963,-76.9344558965702,"Central Penn College, College Hill Road, Summerdale, East Pennsboro Township, Cumberland County, Pennsylvania, 17025, United States"
"Lycoming College",41.245487558099,-76.9997990714827,"Lycoming College, 700, College Place, East End, Williamsport, Lycoming County, Pennsylvania, 17701, United States"
"Kutztown University of Pennsylvania",40.5102873883391,-75.7827119071524,"Kutztown University of Pennsylvania, Apple Alley, Kutztown, Berks County, Pennsylvania, 19536, United States"
"Arcadia University",40.0918583983641,-75.165575030834,"Arcadia University, 450, South Easton Road, Oak Summit, Cheltenham Township, Montgomery County, Pennsylvania, 19038, United States"
"Wilkes University",41.2443087928858,-75.8899850203265,"Wilkes University, St Marys Lane, Wilkes-Barre, Luzerne County, Pennsylvania, 18766, United States"
"Murray H. Goodman Campus",40.5860870177272,-75.3573327565243,"Murray H. Goodman Campus, Seidersville Road, Wagner Terrace, Bethlehem, Northampton County, Pennsylvania, 18055, United States"
"Innovation Park",40.8308046124749,-77.8453146140208,"Innovation Park, Park Avenue, College Township, Centre County, Pennsylvania, 16802, United States"
"Penn State Harrisburg",40.2033619830823,-76.7460192586681,"Penn State Harrisburg, Olmsted Drive, Lower Swatara Township, Dauphin County, Pennsylvania, 17057, United States"
"Engineering Technology Laboratory",40.1981116222276,-76.7446396398512,"Engineering Technology Laboratory, West Harrisburg Pike, Lower Swatara Township, Dauphin County, Pennsylvania, 17057, United States"
"Susquehanna Building",40.1997314002026,-76.7396007493552,"Penn State Harrisburg, Olmsted Drive, Lower Swatara Township, Dauphin County, Pennsylvania, 17057, United States"
"Fleet Services",40.2017773332096,-76.7517450135599,"Fleet Services, Alumni Drive, Lower Swatara Township, Dauphin County, Pennsylvania, 17057, United States"
"University",40.2019779594632,-76.7521105399776,"Alumni Drive, Lower Swatara Township, Dauphin County, Pennsylvania, 17057, United States"
"Church Hall",40.2039121641488,-76.7511564120855,"Church Hall, Meade Avenue, Lower Swatara Township, Dauphin County, Pennsylvania, 17057, United States"
"Wriseburg Hall",40.2032357894146,-76.751571554755,"Wriseburg Hall, Meade Avenue, Lower Swatara Township, Dauphin County, Pennsylvania, 17057, United States"
"Dining Hall",40.2034830647465,-76.7511344278881,"Dining Hall, Alumni Drive, Lower Swatara Township, Dauphin County, Pennsylvania, 17057, United States"
"Stepping Stones Daycare",40.2023327931569,-76.7515593078456,"Stepping Stones Daycare, Alumni Drive, Lower Swatara Township, Dauphin County, Pennsylvania, 17057, United States"
"Kehr Union Building",41.0065652375605,-76.4501323709697,"Kehr Union Building, Schuyler Drive, Bloomsburg, Columbia County, Pennsylvania, 17815, United States"
"Cairn University",40.1667586134811,-74.9075191867605,"Cairn University, South Flowers Mill Road, Fairless Junction, Middletown Township, Bucks County, Pennsylvania, 19047, United States"
"Thomas Jefferson University East Falls Campus",40.0206940386852,-75.1923822089008,"Thomas Jefferson University East Falls Campus, 4201, Henry Avenue, East Falls, Philadelphia, Philadelphia County, Pennsylvania, 19144, United States"
"Penn State Brandywine",39.9277244490242,-75.4480534043255,"Penn State Brandywine, 25, Yearsley Mill Road, Media, Delaware County, Pennsylvania, 19063, United States"
"Grove City College",41.1559985395328,-80.0795745538638,"Grove City College, 100, Campus Drive, Grove City, Mercer County, Pennsylvania, 16127, United States"
"University",40.0203327483014,-75.1916610113815,"Thomas Jefferson University East Falls Campus, 4201, Henry Avenue, East Falls, Philadelphia, Philadelphia County, Pennsylvania, 19144, United States"
"University",40.0193171863202,-75.1787287621615,"West Queen Lane, East Falls, Philadelphia, Philadelphia County, Pennsylvania, 19129, United States"
"Villanova University",40.0369365043091,-75.3419990378117,"Villanova University, Willowbrook Lane, Lower Merion Township, Montgomery County, Pennsylvania, 19085, United States"
"University",40.4246815746489,-79.7430307527234,"Haven Drive, Monroe Heights, Monroeville, Allegheny County, Pennsylvania, 15146, United States"
"Canevin Hall (DU)",40.4362542504325,-79.99229624945,"Duquesne University, McAnulty Drive, Bluff, Pittsburgh, Allegheny County, Pennsylvania, 15219, United States"
"Duquesne University",40.4364795074181,-79.9904507045618,"Duquesne University, McAnulty Drive, Bluff, Pittsburgh, Allegheny County, Pennsylvania, 15219, United States"
"Lavel House (DU)",40.4362353315363,-79.9916765162301,"Duquesne University, McAnulty Drive, Bluff, Pittsburgh, Allegheny County, Pennsylvania, 15219, United States"
"College Hall (DU)",40.436633032462,-79.9900910108147,"College Hall (DU), Locust Street, Bluff, Pittsburgh, Allegheny County, Pennsylvania, 15219, United States"
"Brottier Hall",40.4374472284623,-79.9931069361227,"Brottier Hall, Boyd Street, Bluff, Pittsburgh, Allegheny County, Pennsylvania, 15262, United States"
"Rockwell Hall (School of Business) (DU)",40.4375215088558,-79.9936862110362,"Rockwell Hall (School of Business) (DU), Shingiss Street, Bluff, Pittsburgh, Allegheny County, Pennsylvania, 15219, United States"
"Administration Building",40.4358090515239,-79.9931060548524,"Duquesne University, McAnulty Drive, Bluff, Pittsburgh, Allegheny County, Pennsylvania, 15219, United States"
"Assumption Hall (DU)",40.4354026384186,-79.9871183690064,"Duquesne University, McAnulty Drive, Bluff, Pittsburgh, Allegheny County, Pennsylvania, 15219, United States"
"Trinity Hall (DU)",40.4364847091045,-79.9938305367657,"Duquesne University, McAnulty Drive, Bluff, Pittsburgh, Allegheny County, Pennsylvania, 15219, United States"
"Duquesne University Student Union",40.4366070978807,-79.990867252148,"Duquesne University Student Union, Armstrong Tunnel, Bluff, Pittsburgh, Allegheny County, Pennsylvania, 15282, United States"
"University of Pittsburgh - Bradford Campus",41.9443890261073,-78.6724855271129,"University of Pittsburgh - Bradford Campus, 300, Campus Drive, Bradford, McKean County, Pennsylvania, 16701, United States"
"Harrisburg University of Science and Technology",40.2619395916314,-76.8803444101598,"Harrisburg University of Science and Technology, 326, Market Street, SoMa, Harrisburg, Dauphin County, Pennsylvania, 17101, United States"
"TECH Center",39.9801167932215,-75.1531463631925,"Temple University, 1801, North Broad Street, North Central, Philadelphia, Philadelphia County, Pennsylvania, 19122, United States"
"Howard Gittis Student Center",39.9793801304975,-75.1550003572619,"Temple University, 1801, North Broad Street, North Central, Philadelphia, Philadelphia County, Pennsylvania, 19122, United States"
"Temple University School of Medicine",40.006988228506,-75.1522024676105,"Temple University - Health Sciences Campus, West Venango Street, Chopersville, Philadelphia, Philadelphia County, Pennsylvania, 19140, United States"
"West Chester University (North Campus)",39.9514929337869,-75.59765843697,"West Chester University (North Campus), East Rosedale Avenue, West Chester, Chester County, Pennsylvania, 19382, United States"
"West Chester University (South Campus)",39.937440576998,-75.6009181476922,"West Chester University (South Campus), Suplee Way, Yearsleys Hill, Westtown Township, Chester County, Pennsylvania, 19382, United States"
"Chatham University",40.4482161612175,-79.9247956765611,"Chatham University, Fair Oaks Street, Squirrel Hill North, Pittsburgh, Allegheny County, Pennsylvania, 15217, United States"
"Ritter Hall",39.9794099637558,-75.1559764206595,"Temple University, 1801, North Broad Street, North Central, Philadelphia, Philadelphia County, Pennsylvania, 19122, United States"
"Klein Law Building",39.9798674718771,-75.1569363927431,"Temple University, 1801, North Broad Street, North Central, Philadelphia, Philadelphia County, Pennsylvania, 19122, United States"
"Engineering Building",39.9823777706603,-75.1527771079609,"Temple University, 1801, North Broad Street, North Central, Philadelphia, Philadelphia County, Pennsylvania, 19122, United States"
"Penn State Lehigh Valley",40.558778872311,-75.4033502176724,"Penn State Lehigh Valley, Saucon Valley Road, Friedensville, Upper Saucon, Lehigh County, Pennsylvania, 18034, United States"
"Presser Hall",39.983222281755,-75.1542834458329,"Temple University, 1801, North Broad Street, North Central, Philadelphia, Philadelphia County, Pennsylvania, 19122, United States"
"Tyler School of Art",39.9835548518082,-75.1535058582102,"Temple University, 1801, North Broad Street, North Central, Philadelphia, Philadelphia County, Pennsylvania, 19122, United States"
"Kara Alumni House",40.0667419505307,-79.8871877777566,"Kara Alumni House, 2nd Street, Philipsburg, California, Washington County, Pennsylvania, 15419, United States"
"Pennsylvania Western University, California",40.0641787147344,-79.8841185258147,"Pennsylvania Western University, California, 250, University Avenue, Philipsburg, California, Washington County, Pennsylvania, 15419, United States"
"Waynesburg University",39.8991898322363,-80.1865057856261,"Waynesburg University, Fruit Street, Waynesburg, Greene County, Pennsylvania, 15370, United States"
"East Stroudsburg University",40.9982810906338,-75.1671822101058,"Smith Street Field 1, Fine Arts Drive, East Stroudsburg, Monroe County, Pennsylvania, 18301, United States"
"Penn State Univerity Applied Research Lab Anechoic Chamber",40.203754963374,-75.0541772029486,"Penn State Univerity Applied Research Lab Anechoic Chamber, East Bristol Road, Cornell, Northampton Township, Bucks County, Pennsylvania, 18974, United States"
"Messiah University",40.1563521013097,-76.9858548387939,"Bittner Residence Hall, 320, Mountain View Bridge, Mechanicsburg, Cumberland County, Pennsylvania, 17055, United States"
"Penn State Berks",40.3593122833788,-75.9721913761118,"Penn State Berks, Tulpehocken Road, Spring Ridge, Spring Township, Berks County, Pennsylvania, 19610, United States"
"Keystone College",41.7642407450446,-76.4433815304642,"Keystone College, Main Street, Towanda, Bradford County, Pennsylvania, 18848, United States"
"Keystone College",41.7639726715407,-76.4433369334561,"Keystone College, Main Street, Towanda, Bradford County, Pennsylvania, 18848, United States"
"University of the Arts",39.9460124311144,-75.1658758242835,"University of the Arts, Delancey Place, Gayborhood, Center City, Philadelphia, Philadelphia County, Pennsylvania, 19102, United States"
"Pennsylvania College of Technology",41.2355822587308,-77.0259293540169,"Pennsylvania College of Technology, 1st Street, Millionaire's Row, Williamsport, Lycoming County, Pennsylvania, 17702, United States"
"Cheyney University",39.9329874768608,-75.5295667846986,"Cheyney University, Creek Road, Westtown, Thornbury Township, Chester County, Pennsylvania, 19319, United States"
"Duquesne University",40.4381838810021,-79.9920507155528,"Duquesne University, Forbes Avenue, Bluff, Pittsburgh, Allegheny County, Pennsylvania, 15219, United States"
"Duquesne University",40.4381005345168,-79.9896658256562,"Watson Street, Bluff, Pittsburgh, Allegheny County, Pennsylvania, 15219, United States"
"Duquesne University",40.4386728662552,-79.994358151908,"Duquesne University, Sixth Avenue, Chinatown, Downtown, Pittsburgh, Allegheny County, Pennsylvania, 15219, United States"
"Lincoln University",39.8066275882719,-75.9278856608951,"Lincoln University, 1570, Baltimore Pike, Lower Oxford Township, Chester County, Pennsylvania, 19352, United States"
"Widener University",39.8611439076232,-75.3571072206419,"Widener University, 1, East 18th Street, Chester, Delaware County, Pennsylvania, 19013, United States"
"Curtis Institute of Music",39.9488130510143,-75.1706092669182,"Curtis Institute of Music, 1726, Locust Street, Rittenhouse Square, Center City, Philadelphia, Philadelphia County, Pennsylvania, 19103, United States"
"Temple University",39.9807201193464,-75.1556412929681,"Temple University, 1801, North Broad Street, North Central, Philadelphia, Philadelphia County, Pennsylvania, 19122, United States"
"Temple University School of Podiatric Medicine",39.9546268301138,-75.153491440859,"Temple University School of Podiatric Medicine, North 8th Street, Center City, Philadelphia, Philadelphia County, Pennsylvania, 19133, United States"
"Drexel University College Of Medicine",39.9567333546912,-75.1646781817163,"Drexel University - Center City Campus, Race Street, Fashion District Philadelphia, Center City, Philadelphia, Philadelphia County, Pennsylvania, 19103, United States"
"Clarion University",41.2096840412754,-79.3779341897808,"Clarion University, 9th Avenue, Clarion, Clarion County, Pennsylvania, 16214, United States"
"La Roche University",40.5684334630011,-80.0138217883246,"La Roche University, Duncan Avenue, McCandless, Allegheny County, Pennsylvania, 15237, United States"
"Reconstructionist Rabbinical College",40.0876560698071,-75.1493953629028,"Reconstructionist Rabbinical College, 1299, Church Road, Chelten Hills, Cheltenham Township, Montgomery County, Pennsylvania, 19095, United States"
"Delaware Valley University",40.2943614307512,-75.160163156394,"Delaware Valley University, Campus Loop Road, New Britain, Doylestown Township, Bucks County, Pennsylvania, 18923, United States"
"Penn State Hazleton",40.9847365371588,-76.029134256304,"University Drive, College Crest Colony, Dippel Manor, Sugarloaf Township, Luzerne County, Pennsylvania, 18219, United States"
"Community College of Allegheny County - South Campus",40.3296270854376,-79.9239553622085,"Community College of Allegheny County - South Campus, 1750, College Drive, New England, West Mifflin, Allegheny County, Pennsylvania, 15122, United States"
"Penn State Beaver",40.6789010968605,-80.2964918672842,"Penn State Beaver, Lafayette Drive, Center Township, Beaver County, Pennsylvania, 15061, United States"
"Penn State Great Valley",40.0529246761877,-75.5221852973661,"Penn State Great Valley, Swedesford Road, East Whiteland Township, Chester County, Pennsylvania, 19355, United States"
"Penn State Greater Allegheny",40.3459042442984,-79.826442793293,"Penn State Greater Allegheny, Broadway Avenue, White Oak, Allegheny County, Pennsylvania, 15132, United States"
"Penn State Hershey",40.265266805445,-76.6729771517533,"Penn State Hershey, US 322, Hershey West End, Hershey, Dauphin County, Pennsylvania, 17036, United States"
"Penn State Mont Alto",39.8403069412162,-77.5429211685939,"Penn State Mont Alto, 1, Campus Drive, Mont Alto, Franklin County, Pennsylvania, 17237, United States"
"Penn State New Kensington",40.5484517274175,-79.6964405673799,"Penn State New Kensington, 7th Street Road, Milligantown, Upper Burrell Township, Westmoreland County, Pennsylvania, 15068, United States"
"Penn State Schuylkill",40.6412499156479,-76.1662532813826,"Penn State Schuylkill, PA 61;PA 443, North Manheim Township, Schuylkill County, Pennsylvania, 17972, United States"
"Penn State Shenango",41.2358066751166,-80.5085103431433,"Penn State Shenango, East Silver Street, Sharon, Mercer County, Pennsylvania, 16146, United States"
"Penn State Wilkes-Barre",41.306616628824,-76.014917302476,"Penn State Wilkes-Barre, Nittany Drive, Lehman, Lehman Township, Luzerne County, Pennsylvania, 18612, United States"
"Penn State Scranton",41.4407070415629,-75.6215386420624,"Penn State Scranton, O'Neill Highway, Dunmore, Lackawanna County, Pennsylvania, 18512, United States"
"Neumann University",39.8752740566828,-75.4403863769805,"Neumann University, 1, Neumann Drive, Aston Township, Delaware County, Pennsylvania, 19014, United States"
"Marywood University",41.4347780961754,-75.6322633119748,"Marywood University, I 81;US 6, Dunmore, Lackawanna County, Pennsylvania, 18512, United States"
"Clarion University of Pennsylvania Venango Campus",41.4094986324613,-79.728844163579,"Clarion University of Pennsylvania Venango Campus, 1801, West 1st Street, Oil City, Venango County, Pennsylvania, 16301, United States"
"Penn State Fayette Campus",39.9456331223609,-79.6591937398941,"Penn State Fayette Campus, University Drive, North Union Township, Fayette County, Pennsylvania, 15456, United States"
"University",40.3356106423861,-76.515744400337,"North Ulrich Street, Annville, Lebanon County, Pennsylvania, 17003, United States"
"Temple University",39.9810305838928,-75.1564519722518,"Temple University, 1801, North Broad Street, North Central, Philadelphia, Philadelphia County, Pennsylvania, 19122, United States"
"Temple University - Ambler Campus",40.1658104244981,-75.1947690416681,"Temple University - Ambler Campus, Woods Drive, The Woods, Ambler, Montgomery County, Pennsylvania, 19002, United States"
"Temple University - Health Sciences Campus",40.0049806808736,-75.1517890232386,"Temple University - Health Sciences Campus, West Venango Street, Chopersville, Philadelphia, Philadelphia County, Pennsylvania, 19140, United States"
"University",40.0559576385304,-74.9848949343424,"Grant Avenue, Chestnut Wood Village, Philadelphia, Philadelphia County, Pennsylvania, 19114, United States"
"Holy Family University",40.0601847457899,-74.9865176145319,"Holy Family University, Mill Road, Andalusia, Bensalem Township, Bucks County, Pennsylvania, 19154, United States"
"PennWest Edinboro",41.8715173872979,-80.1196048271805,"PennWest Edinboro, 219, Meadville Street, Edinboro, Erie County, Pennsylvania, 16444, United States"
"Holy Family University - Newtown Campus",40.2279430379597,-74.8937133838856,"Holy Family University - Newtown Campus, Campus Drive, Newtown Township, Bucks County, Pennsylvania, 18940, United States"
"Commonwealth University of Pennsylvania - Mansfield",41.8051314676975,-77.0702625131891,"Commonwealth University of Pennsylvania - Mansfield, 31, South Academy Street, Paisley, Mansfield, Tioga County, Pennsylvania, 16933, United States"
"Westminster College",41.1175226628641,-80.3285756861006,"Westminster College, 319, South Market Street, New Wilmington, Lawrence County, Pennsylvania, 16172, United States"
"Penn State Dickinson Law",40.1997172000849,-77.197889475918,"Penn State Dickinson Law, Mooreland Avenue, Carlisle, Cumberland County, Pennsylvania, 17013, United States"
"Dickinson College",40.2025953019596,-77.1991098333966,"Dickinson College, West Pomfret Street, Carlisle, Cumberland County, Pennsylvania, 17030, United States"
"Susquehanna University",40.7971325335954,-76.8740060422588,"Susquehanna University, 514, University Avenue, Selinsgrove, Snyder County, Pennsylvania, 17870, United States"
"Millersville University",39.9982216377914,-76.3528308298051,"Millersville University, South George Street, Millersville, Lancaster County, Pennsylvania, 17551, United States"
"Philadelphia College of Osteopathic Medicine",40.0041993336767,-75.2152051149123,"Stout Road, Pencoyd, Wynnefield Heights, Philadelphia, Philadelphia County, Pennsylvania, 19004, United States"
"Slippery Rock University",41.0642361589048,-80.0408305332906,"Slippery Rock University, 1, Morrow Way, Slippery Rock, Butler County, Pennsylvania, 16057, United States"
"Indiana University of Pennsylvania",40.6158605605689,-79.1598543372443,"Indiana University of Pennsylvania, South Foundry Avenue, Indiana, Indiana County, Pennsylvania, 15705, United States"
"Washington & Jefferson College",40.1712845945287,-80.2402972790193,"Washington & Jefferson College, 6th Street, Washington, Washington County, Pennsylvania, 15301, United States"
"IUP",40.9458186844401,-78.9897091695729,"Center Street, Punxsutawney, Jefferson County, Pennsylvania, 15767, United States"
"Mount Aloysius College",40.4589842830621,-78.6043498655905,"Mount Aloysius College, College Drive, Cresson Township, Cambria County, Pennsylvania, 16630, United States"
"Seton Hill University",40.3104459750763,-79.5561080374669,"Seton Hill University, Borlin Way, Ludwick, Greensburg, Westmoreland County, Pennsylvania, 15601, United States"
"DeSales University",40.5382032351836,-75.3794786591477,"DeSales University, Karra Court, Upper Saucon, Lehigh County, Pennsylvania, 18034, United States"
